<?xml version = '1.0' encoding = 'UTF-8'?>
<tns:ODM FileType="Transactional" FileOID="7b934e87-8669-4522-bfbb-11eeb2fa0751" CreationDateTime="2021-01-20T06:02:09.776-00:00" ODMVersion="1.3" xmlns:fn="http://www.w3.org/2005/xpath-functions" xmlns:DVMFunctions="http://www.oracle.com/XSL/Transform/java/com.bea.wli.sb.functions.dvm.DVMFunctions" xmlns:plnk="http://docs.oasis-open.org/wsbpel/2.0/plnktype" xmlns:ns1="http://soa.incresearch.com/Rave/URL" xmlns:java="http://www.oracle.com/XSL/Transform/java/java.lang.String" xmlns:wsdl="http://schemas.xmlsoap.org/wsdl/" xmlns:XrefFunctions="http://www.oracle.com/XSL/Transform/java/com.bea.wli.sb.functions.xref.XrefFunctions" xmlns:IsUserInGroupFunction="http://www.oracle.com/XSL/Transform/java/com.bea.wli.sb.stages.functions.IsUserInGroupFunction" xmlns:client="http://xmlns.oracle.com/RaveSTSPOC/DemoStudyTFM/DemoStudyBPELProcess" xmlns:BasicCredentialsUserFunction="http://www.oracle.com/XSL/Transform/java/com.bea.wli.sb.stages.functions.BasicCredentialsUserFunction" xmlns:RuntimeTypeConversionFunctions="http://www.oracle.com/XSL/Transform/java/com.bea.wli.sb.stages.functions.RuntimeTypeConversionFunctions" xmlns:UUIDUserFunction="http://www.oracle.com/XSL/Transform/java/com.bea.wli.sb.stages.functions.UUIDUserFunction" xmlns:mdsol="http://www.mdsol.com/ns/odm/metadata" xmlns:IsUserInRoleFunction="http://www.oracle.com/XSL/Transform/java/com.bea.wli.sb.stages.functions.IsUserInRoleFunction" xmlns:xlink="http://www.w3.org/1999/xlink" xmlns:tns="http://www.cdisc.org/ns/odm/v1.3" xmlns:xsi="http://www.w3.org/2001/XMLSchema-instance" xsi:schemaLocation="http://www.cdisc.org/ns/odm/v1.3 file:/Users/shrek/jdeveloper/mywork/RaveSTSServiceBusApplication/ResourceRepository/RaveSTS/Schemas/RaveODM.xsd">
   <tns:ClinicalData MetaDataVersionOID="80" StudyOID="">
      <tns:SubjectData TransactionType="Update" SubjectKey="007-005-001">
         <tns:SiteRef LocationOID="targetLocationOID200"/>
         <tns:StudyEventData StudyEventOID="V0" StudyEventRepeatKey="1" TransactionType="Update">
            <tns:FormData FormOID="DM" FormRepeatKey="1" TransactionType="Update">
               <tns:ItemGroupData ItemGroupOID="DM_LOG_LINE" TransactionType="Update">
                  <tns:ItemData mdsol:Lock="AsFound" ItemOID="DM.AGE" Value="53" TransactionType="Update"/>
                  <tns:ItemData mdsol:Lock="AsFound" ItemOID="DM.CBP" IsNull="Yes" TransactionType="Update"/>
                  <tns:ItemData mdsol:Lock="AsFound" ItemOID="DM.DOB" Value="28/FEB/1967" TransactionType="Update"/>
                  <tns:ItemData mdsol:Lock="AsFound" ItemOID="DM.ETHNIC" IsNull="Yes" TransactionType="Update"/>
                  <tns:ItemData mdsol:Lock="AsFound" ItemOID="DM.RACE" IsNull="Yes" TransactionType="Update"/>
                  <tns:ItemData mdsol:Lock="AsFound" ItemOID="DM.RACESP" IsNull="Yes" TransactionType="Update"/>
                  <tns:ItemData mdsol:Lock="AsFound" ItemOID="DM.SEX" Value="M" TransactionType="Update"/>
               </tns:ItemGroupData>
            </tns:FormData>
         </tns:StudyEventData>
      </tns:SubjectData>
   </tns:ClinicalData>
   <tns:ClinicalData MetaDataVersionOID="80" StudyOID="">
      <tns:SubjectData TransactionType="Update" SubjectKey="007-005-001">
         <tns:SiteRef LocationOID="targetLocationOID200"/>
         <tns:StudyEventData StudyEventOID="SUBJECT" TransactionType="Update">
            <tns:FormData FormOID="EN" FormRepeatKey="1" TransactionType="Update">
               <tns:ItemGroupData ItemGroupOID="EN_LOG_LINE" TransactionType="Update">
                  <tns:ItemData mdsol:Lock="AsFound" ItemOID="EN.SUBJID" Value="007-005-001" TransactionType="Update"/>
               </tns:ItemGroupData>
            </tns:FormData>
         </tns:StudyEventData>
      </tns:SubjectData>
   </tns:ClinicalData>
   <tns:ClinicalData MetaDataVersionOID="80" StudyOID="">
      <tns:SubjectData TransactionType="Update" SubjectKey="007-005-001">
         <tns:SiteRef LocationOID="targetLocationOID200"/>
         <tns:StudyEventData StudyEventOID="V0" StudyEventRepeatKey="1" TransactionType="Update">
            <tns:FormData FormOID="MH" FormRepeatKey="1" TransactionType="Update">
               <tns:ItemGroupData ItemGroupOID="MH_LOG_LINE" ItemGroupRepeatKey="1" TransactionType="Update">
                  <tns:ItemData mdsol:Lock="AsFound" ItemOID="MH.MHENDAT" IsNull="Yes" TransactionType="Update"/>
                  <tns:ItemData mdsol:Lock="AsFound" ItemOID="MH.MHONG" Value="1" TransactionType="Update"/>
                  <tns:ItemData mdsol:Lock="AsFound" ItemOID="MH.MHSTDAT" Value="un/UNK/1988" TransactionType="Update"/>
                  <tns:ItemData mdsol:Lock="AsFound" ItemOID="MH.RECGUID" Value="Schizophrenia" TransactionType="Context"/>
               </tns:ItemGroupData>
            </tns:FormData>
         </tns:StudyEventData>
      </tns:SubjectData>
   </tns:ClinicalData>
   <tns:ClinicalData MetaDataVersionOID="80" StudyOID="">
      <tns:SubjectData TransactionType="Update" SubjectKey="007-005-001">
         <tns:SiteRef LocationOID="targetLocationOID200"/>
         <tns:StudyEventData StudyEventOID="V0" StudyEventRepeatKey="1" TransactionType="Update">
            <tns:FormData FormOID="PE" FormRepeatKey="1" TransactionType="Update">
               <tns:ItemGroupData ItemGroupOID="PE_LOG_LINE" ItemGroupRepeatKey="1" TransactionType="Update">
                  <tns:ItemData mdsol:Lock="AsFound" ItemOID="PE.BODYSYS" Value="1" TransactionType="Context"/>
                  <tns:ItemData mdsol:Lock="AsFound" ItemOID="PE.FINDING" Value="2" TransactionType="Update"/>
                  <tns:ItemData mdsol:Lock="AsFound" ItemOID="PE.PEABNSP" IsNull="Yes" TransactionType="Update"/>
                  <tns:ItemData mdsol:Lock="AsFound" ItemOID="PE.PEDAT" Value="21/Dec/2020" TransactionType="Update"/>
                  <tns:ItemData mdsol:Lock="AsFound" ItemOID="PE.PEREAS" IsNull="Yes" TransactionType="Update"/>
                  <tns:ItemData mdsol:Lock="AsFound" ItemOID="PE.PEYN" Value="Y" TransactionType="Update"/>
                  <tns:ItemData mdsol:Lock="AsFound" ItemOID="PE.TEMP" Value="36.7" TransactionType="Update"/>
               </tns:ItemGroupData>
            </tns:FormData>
         </tns:StudyEventData>
      </tns:SubjectData>
   </tns:ClinicalData>
   <tns:ClinicalData MetaDataVersionOID="80" StudyOID="">
      <tns:SubjectData TransactionType="Update" SubjectKey="007-005-001">
         <tns:SiteRef LocationOID="targetLocationOID200"/>
         <tns:StudyEventData StudyEventOID="V0" StudyEventRepeatKey="1" TransactionType="Update">
            <tns:FormData FormOID="VS" FormRepeatKey="1" TransactionType="Update">
               <tns:ItemGroupData ItemGroupOID="VS_LOG_LINE" ItemGroupRepeatKey="1" TransactionType="Update">
                  <tns:ItemData mdsol:Lock="AsFound" ItemOID="VS.HEIGHT" Value="190.5" TransactionType="Update"/>
                  <tns:ItemData mdsol:Lock="AsFound" ItemOID="VS.HEIGHTU" Value="1" TransactionType="Update"/>
               </tns:ItemGroupData>
            </tns:FormData>
         </tns:StudyEventData>
      </tns:SubjectData>
   </tns:ClinicalData>
   <tns:ClinicalData MetaDataVersionOID="80" StudyOID="">
      <tns:SubjectData TransactionType="Update" SubjectKey="007-005-001">
         <tns:SiteRef LocationOID="targetLocationOID200"/>
         <tns:StudyEventData StudyEventOID="V0" StudyEventRepeatKey="1" TransactionType="Update">
            <tns:FormData FormOID="VS" FormRepeatKey="1" TransactionType="Update">
               <tns:ItemGroupData ItemGroupOID="VS_LOG_LINE" ItemGroupRepeatKey="2" TransactionType="Update">
                  <tns:ItemData mdsol:Lock="AsFound" ItemOID="VS.HEIGHT" Value="190.5" TransactionType="Update"/>
                  <tns:ItemData mdsol:Lock="AsFound" ItemOID="VS.HEIGHTU" Value="1" TransactionType="Update"/>
               </tns:ItemGroupData>
            </tns:FormData>
         </tns:StudyEventData>
      </tns:SubjectData>
   </tns:ClinicalData>
</tns:ODM>
