<tns:ODM FileType="Transactional" FileOID="7bb0a590-b5ce-4f90-b659-5654bd00a213" CreationDateTime="2020-12-14T09:44:33.455-00:00" ODMVersion="1.3" xmlns:fn="http://www.w3.org/2005/xpath-functions" xmlns:DVMFunctions="http://www.oracle.com/XSL/Transform/java/com.bea.wli.sb.functions.dvm.DVMFunctions" xmlns:plnk="http://docs.oasis-open.org/wsbpel/2.0/plnktype" xmlns:ns1="http://soa.incresearch.com/Rave/URL" xmlns:java="http://www.oracle.com/XSL/Transform/java/java.lang.String" xmlns:wsdl="http://schemas.xmlsoap.org/wsdl/" xmlns:XrefFunctions="http://www.oracle.com/XSL/Transform/java/com.bea.wli.sb.functions.xref.XrefFunctions" xmlns:IsUserInGroupFunction="http://www.oracle.com/XSL/Transform/java/com.bea.wli.sb.stages.functions.IsUserInGroupFunction" xmlns:client="http://xmlns.oracle.com/RaveSTSPOC/DemoStudyTFM/DemoStudyBPELProcess" xmlns:BasicCredentialsUserFunction="http://www.oracle.com/XSL/Transform/java/com.bea.wli.sb.stages.functions.BasicCredentialsUserFunction" xmlns:RuntimeTypeConversionFunctions="http://www.oracle.com/XSL/Transform/java/com.bea.wli.sb.stages.functions.RuntimeTypeConversionFunctions" xmlns:UUIDUserFunction="http://www.oracle.com/XSL/Transform/java/com.bea.wli.sb.stages.functions.UUIDUserFunction" xmlns:mdsol="http://www.mdsol.com/ns/odm/metadata" xmlns:IsUserInRoleFunction="http://www.oracle.com/XSL/Transform/java/com.bea.wli.sb.stages.functions.IsUserInRoleFunction" xmlns:xlink="http://www.w3.org/1999/xlink" xmlns:tns="http://www.cdisc.org/ns/odm/v1.3" xmlns:xsi="http://www.w3.org/2001/XMLSchema-instance" xsi:schemaLocation="http://www.cdisc.org/ns/odm/v1.3 file:/Users/shrek/jdeveloper/mywork/RaveSTSServiceBusApplication/ResourceRepository/RaveSTS/Schemas/RaveODM.xsd">
   <tns:ClinicalData MetaDataVersionOID="668" StudyOID="">
      <tns:SubjectData TransactionType="Update" SubjectKey="targetSubjectKey171">
         <tns:SiteRef LocationOID="targetLocationOID172"/>
         <tns:StudyEventData StudyEventOID="BASE" StudyEventRepeatKey="1" TransactionType="Update">
            <tns:FormData FormOID="PK" FormRepeatKey="1" TransactionType="Update">
               <tns:ItemGroupData ItemGroupOID="PK_LOG_LINE" TransactionType="Update">
                  <tns:ItemData mdsol:Lock="AsFound" ItemOID="PK.PKDAT" Value="07/Dec/2021" TransactionType="Update"/>
                  <tns:ItemData mdsol:Lock="AsFound" ItemOID="PK.PKND" Value="0" TransactionType="Update"/>
                  <tns:ItemData mdsol:Lock="AsFound" ItemOID="PK.PKTM" Value="10:23" TransactionType="Update"/>
               </tns:ItemGroupData>
            </tns:FormData>
         </tns:StudyEventData>
         <tns:StudyEventData StudyEventOID="BASE" StudyEventRepeatKey="1" TransactionType="Update">
            <tns:FormData FormOID="ADA" FormRepeatKey="1" TransactionType="Update">
               <tns:ItemGroupData ItemGroupOID="ADA_LOG_LINE" TransactionType="Update">
                  <tns:ItemData mdsol:Lock="AsFound" ItemOID="ADA.ADADAT" Value="07/Dec/2021" TransactionType="Update"/>
                  <tns:ItemData mdsol:Lock="AsFound" ItemOID="ADA.ADAND" Value="0" TransactionType="Update"/>
                  <tns:ItemData mdsol:Lock="AsFound" ItemOID="ADA.ADATM" Value="11:00" TransactionType="Update"/>
               </tns:ItemGroupData>
            </tns:FormData>
         </tns:StudyEventData>
      </tns:SubjectData>
   </tns:ClinicalData>
</tns:ODM>
