<?xml version = '1.0' encoding = 'UTF-8'?>
<ns0:ODM xmlns:BasicCredentialsUserFunction="http://www.oracle.com/XSL/Transform/java/com.bea.wli.sb.stages.functions.BasicCredentialsUserFunction" xmlns:DVMFunctions="http://www.oracle.com/XSL/Transform/java/com.bea.wli.sb.functions.dvm.DVMFunctions" xmlns:UUIDUserFunction="http://www.oracle.com/XSL/Transform/java/com.bea.wli.sb.stages.functions.UUIDUserFunction" xmlns:XrefFunctions="http://www.oracle.com/XSL/Transform/java/com.bea.wli.sb.functions.xref.XrefFunctions" xmlns:mdsol="http://www.mdsol.com/ns/odm/metadata" xmlns:IsUserInGroupFunction="http://www.oracle.com/XSL/Transform/java/com.bea.wli.sb.stages.functions.IsUserInGroupFunction" xmlns:IsUserInRoleFunction="http://www.oracle.com/XSL/Transform/java/com.bea.wli.sb.stages.functions.IsUserInRoleFunction" xmlns:xlink="http://www.w3.org/1999/xlink" xmlns:ns0="http://www.cdisc.org/ns/odm/v1.3" FileType="Transactional" FileOID="7b934e87-8669-4522-bfbb-11eeb2fa0751" CreationDateTime="2021-01-20T06:02:09.776-00:00" ODMVersion="1.3" xmlns:xsi="http://www.w3.org/2001/XMLSchema-instance" xsi:schemaLocation="http://www.cdisc.org/ns/odm/v1.3 file:/Users/shrek/jdeveloper/mywork/RaveSTSServiceBusApplication/ResourceRepository/RaveSTS/Schemas/RaveODM.xsd">
   <ns0:ClinicalData StudyOID="" MetaDataVersionOID="80">
      <ns0:SubjectData SubjectKey="007-005-001" TransactionType="Update">
         <ns0:SiteRef LocationOID="targetLocationOID200"/>
         <ns0:StudyEventData StudyEventOID="V0" StudyEventRepeatKey="1" TransactionType="Update">
            <ns0:FormData FormOID="DM" FormRepeatKey="1" TransactionType="Update">
               <ns0:ItemGroupData ItemGroupOID="DM_LOG_LINE" TransactionType="Update">
                  <ns0:ItemData mdsol:Lock="AsFound" ItemOID="DM.AGE" Value="53" TransactionType="Update"/>
                  <ns0:ItemData mdsol:Lock="AsFound" ItemOID="DM.CBP" IsNull="Yes" TransactionType="Update"/>
                  <ns0:ItemData mdsol:Lock="AsFound" ItemOID="DM.DOB" Value="28/FEB/1967" TransactionType="Update"/>
                  <ns0:ItemData mdsol:Lock="AsFound" ItemOID="DM.ETHNIC" IsNull="Yes" TransactionType="Update"/>
                  <ns0:ItemData mdsol:Lock="AsFound" ItemOID="DM.RACE" IsNull="Yes" TransactionType="Update"/>
                  <ns0:ItemData mdsol:Lock="AsFound" ItemOID="DM.RACESP" IsNull="Yes" TransactionType="Update"/>
                  <ns0:ItemData mdsol:Lock="AsFound" ItemOID="DM.SEX" Value="M" TransactionType="Update"/>
               </ns0:ItemGroupData>
            </ns0:FormData>
         </ns0:StudyEventData>
         <ns0:StudyEventData StudyEventOID="SUBJECT" TransactionType="Update">
            <ns0:FormData FormOID="EN" FormRepeatKey="1" TransactionType="Update">
               <ns0:ItemGroupData ItemGroupOID="EN_LOG_LINE" TransactionType="Update">
                  <ns0:ItemData mdsol:Lock="AsFound" ItemOID="EN.SUBJID" Value="007-005-001" TransactionType="Update"/>
               </ns0:ItemGroupData>
            </ns0:FormData>
         </ns0:StudyEventData>
         <ns0:StudyEventData StudyEventOID="V0" StudyEventRepeatKey="1" TransactionType="Update">
            <ns0:FormData FormOID="MH" FormRepeatKey="1" TransactionType="Update">
               <ns0:ItemGroupData ItemGroupOID="MH_LOG_LINE" ItemGroupRepeatKey="@CONTEXT" TransactionType="Upsert">
                  <ns0:ItemData mdsol:Lock="AsFound" ItemOID="MH.MHENDAT" IsNull="Yes" TransactionType="Update"/>
                  <ns0:ItemData mdsol:Lock="AsFound" ItemOID="MH.MHONG" Value="1" TransactionType="Update"/>
                  <ns0:ItemData mdsol:Lock="AsFound" ItemOID="MH.MHSTDAT" Value="un/UNK/1988" TransactionType="Update"/>
                  <ns0:ItemData mdsol:Lock="AsFound" ItemOID="MH.RECGUID" Value="Schizophrenia" TransactionType="Context"/>
               </ns0:ItemGroupData>
            </ns0:FormData>
         </ns0:StudyEventData>
         <ns0:StudyEventData StudyEventOID="V0" StudyEventRepeatKey="1" TransactionType="Update">
            <ns0:FormData FormOID="PE" FormRepeatKey="1" TransactionType="Update">
               <ns0:ItemGroupData ItemGroupOID="PE_LOG_LINE" ItemGroupRepeatKey="@CONTEXT" TransactionType="Upsert">
                  <ns0:ItemData mdsol:Lock="AsFound" ItemOID="PE.BODYSYS" Value="1" TransactionType="Context"/>
                  <ns0:ItemData mdsol:Lock="AsFound" ItemOID="PE.FINDING" Value="2" TransactionType="Update"/>
                  <ns0:ItemData mdsol:Lock="AsFound" ItemOID="PE.PEABNSP" IsNull="Yes" TransactionType="Update"/>
                  <ns0:ItemData mdsol:Lock="AsFound" ItemOID="PE.PEDAT" Value="21/Dec/2020" TransactionType="Update"/>
                  <ns0:ItemData mdsol:Lock="AsFound" ItemOID="PE.PEREAS" IsNull="Yes" TransactionType="Update"/>
                  <ns0:ItemData mdsol:Lock="AsFound" ItemOID="PE.PEYN" Value="Y" TransactionType="Update"/>
                  <ns0:ItemData mdsol:Lock="AsFound" ItemOID="PE.TEMP" Value="36.7" TransactionType="Update"/>
               </ns0:ItemGroupData>
            </ns0:FormData>
         </ns0:StudyEventData>
         <ns0:StudyEventData StudyEventOID="V0" StudyEventRepeatKey="1" TransactionType="Update">
            <ns0:FormData FormOID="VS" FormRepeatKey="1" TransactionType="Update">
               <ns0:ItemGroupData ItemGroupOID="VS_LOG_LINE" ItemGroupRepeatKey="1" TransactionType="Update">
                  <ns0:ItemData mdsol:Lock="AsFound" ItemOID="VS.HEIGHT" Value="190.5" TransactionType="Update"/>
                  <ns0:ItemData mdsol:Lock="AsFound" ItemOID="VS.HEIGHTU" Value="1" TransactionType="Update"/>
               </ns0:ItemGroupData>
            </ns0:FormData>
         </ns0:StudyEventData>
         <ns0:StudyEventData StudyEventOID="V0" StudyEventRepeatKey="1" TransactionType="Update">
            <ns0:FormData FormOID="VS" FormRepeatKey="1" TransactionType="Update">
               <ns0:ItemGroupData ItemGroupOID="VS_LOG_LINE" ItemGroupRepeatKey="2" TransactionType="Update">
                  <ns0:ItemData mdsol:Lock="AsFound" ItemOID="VS.HEIGHT" Value="190.5" TransactionType="Update"/>
                  <ns0:ItemData mdsol:Lock="AsFound" ItemOID="VS.HEIGHTU" Value="1" TransactionType="Update"/>
               </ns0:ItemGroupData>
            </ns0:FormData>
         </ns0:StudyEventData>
      </ns0:SubjectData>
   </ns0:ClinicalData>
</ns0:ODM>
